{
  "$schema": "https://json-schema.org/draft/2020-12/schema",
  "title": "A dimension and its units",
  "description": "One file per dimension, units/<key>.json: the dimension, the unit its conversions lead to, and its units in each system (PRD 03 §9: metric by default, imperial available for length, area, mass, temperature and volume). A quantity is stored in one unit and shown in the household's system through the unit's counterpart.",
  "type": "object",
  "required": ["key", "name", "base_unit", "units"],
  "properties": {
    "$schema": { "type": "string" },
    "key": {
      "description": "The dimension's key, and the file's name: the record's key, the one field without a source.",
      "$ref": "defs.schema.json#/$defs/key"
    },
    "name": { "$ref": "defs.schema.json#/$defs/localizedField" },
    "base_unit": {
      "description": "The key of the unit every other unit of the dimension converts to. Its own conversion is the identity.",
      "$ref": "defs.schema.json#/$defs/keyField"
    },
    "units": { "type": "array", "minItems": 1, "items": { "$ref": "#/$defs/unit" } }
  },
  "additionalProperties": false,
  "$defs": {
    "unit": {
      "type": "object",
      "required": ["key", "system", "symbol", "cldr", "name", "to_base"],
      "properties": {
        "key": {
          "description": "The unit's key, unique across every dimension: the record's key, the one field without a source.",
          "$ref": "defs.schema.json#/$defs/key"
        },
        "system": { "$ref": "defs.schema.json#/$defs/unitSystemField" },
        "symbol": {
          "description": "The unit's symbol, the same in every language.",
          "$ref": "defs.schema.json#/$defs/textField"
        },
        "cldr": {
          "description": "The unit's Unicode CLDR identifier, which ICU formats a quantity in (Intl.NumberFormat's unit style, where the platform supports the unit).",
          "$ref": "defs.schema.json#/$defs/field",
          "properties": { "value": { "type": "string", "pattern": "^[a-z]+(-[a-z]+)*$" } }
        },
        "name": { "$ref": "defs.schema.json#/$defs/localizedField" },
        "to_base": {
          "description": "The exact conversion to the dimension's base unit: base = (value + offset) × numerator ÷ denominator. A fraction where the factor has no finite decimal, as 5/9 for °F.",
          "$ref": "defs.schema.json#/$defs/field",
          "properties": {
            "value": {
              "type": "object",
              "required": ["offset", "numerator", "denominator"],
              "properties": {
                "offset": { "$ref": "defs.schema.json#/$defs/decimal" },
                "numerator": { "$ref": "defs.schema.json#/$defs/positiveDecimal" },
                "denominator": { "$ref": "defs.schema.json#/$defs/positiveDecimal" }
              },
              "additionalProperties": false
            }
          }
        },
        "counterpart": {
          "description": "The key of the unit of the other system a quantity in this unit is shown in, when the household uses that system. Absent where the quantity is shown as it is in both.",
          "$ref": "defs.schema.json#/$defs/keyField"
        }
      },
      "additionalProperties": false
    }
  }
}
